{
  "$schema": "https://json-schema.org/draft/2020-12/schema",
  "$id": "https://orvane/schemas/profil.schema.json",
  "title": "Orvane — profil d'un monde (réglage du tampon)",
  "description": "Un fichier par monde. Il règle le tampon dans le sens jeu → Orvane : comment les actes des joueurs de tous les jeux branchés pèsent sur le monde. Ce que chaque jeu montre du monde (exposition) est réglé par le jeu lui-même dans le Supabase d'Orvane (orvane_regler_jeu, hebergement/LISEZ-MOI.md) et publié dans jeux.json ; l'exposition d'un profil de monde ne sert plus qu'aux lots sans jeu (et aux mondes d'avant, comme sv-1). Rien ici ne touche à la biologie elle-même.",
  "type": "object",
  "required": [
    "orvane",
    "monde",
    "influence"
  ],
  "additionalProperties": false,
  "properties": {
    "orvane": {
      "type": "string"
    },
    "jeu": {
      "type": "string",
      "description": "Le jeu pour lequel le monde a été fait (mondes d'avant, comme sv-1). Un monde universel n'en a pas."
    },
    "monde": {
      "type": "object",
      "required": [
        "id",
        "graine",
        "cycle"
      ],
      "additionalProperties": false,
      "properties": {
        "id": {
          "type": "string"
        },
        "graine": {
          "type": "integer"
        },
        "cycle": {
          "type": "string",
          "description": "Durée réelle d'un cycle : « 24h », « 6h », « 7d ». Le moteur tourne une fois par cycle."
        },
        "biomes": {
          "type": "string",
          "description": "Chemin du fichier décrivant les biomes du monde (axes, capacités, voisins) ; sinon les biomes par défaut d'Orvane."
        },
        "amorce": {
          "type": "string",
          "description": "Chemin d'un instantané de départ (génération 0) si le jeu part d'un bestiaire existant."
        },
        "rodage": {
          "type": "integer",
          "minimum": 0,
          "description": "Au premier cycle, le monde tourne seul autant de cycles avant d’être publié : la génération 0 est alors un équilibre, pas une amorce brute."
        },
        "annee": {
          "type": "integer",
          "minimum": 0,
          "description": "Durée de l’année en cycles (120 : quatre saisons de 30 jours avec un cycle de 24 h). 0 : pas de saisons. Recopié dans monde.annee de l’instantané à chaque cycle."
        },
        "historique": {
          "type": "integer",
          "minimum": 1,
          "description": "Combien de cycles allégés garder dans historique.json (365 par défaut)."
        },
        "nocturne": {
          "type": "boolean",
          "default": true,
          "description": "false : le cycle nocturne passe ce monde (hebergement/cycle.js --forcer pour le faire tourner quand même)."
        },
        "pressions": {
          "type": "object",
          "description": "Où l'action nocturne lit les lots de pressions de ce monde : le Supabase d'Orvane (url), sa clé PUBLIQUE (cle), la fonction de lecture des lots (orvane_lire_lots), celle des jeux (jeux : orvane_lire_jeux) et le NOM de la variable d'environnement qui porte le secret de lecture d'Orvane. Le secret lui-même n'est jamais dans le profil.",
          "properties": {
            "url": {
              "type": "string"
            },
            "cle": {
              "type": "string"
            },
            "fonction": {
              "type": "string"
            },
            "secret": {
              "type": "string"
            },
            "jeux": {
              "type": "string",
              "description": "La fonction qui liste les jeux et leur exposition (orvane_lire_jeux). Sans elle, les lots sont lus avec l'exposition du profil."
            }
          },
          "required": [
            "url",
            "cle"
          ],
          "additionalProperties": false
        }
      }
    },
    "exposition": {
      "type": "object",
      "description": "Sens Orvane → jeu. Le même objet est l'exposition d'un jeu, envoyée par orvane_regler_jeu.",
      "required": [
        "compression",
        "propagation_cycles"
      ],
      "additionalProperties": false,
      "properties": {
        "compression": {
          "type": "object",
          "required": [
            "defaut"
          ],
          "additionalProperties": false,
          "description": "Facteur k appliqué à la COTE d’un phénotype (f/(1−f)) avant exposition : avec k = 0,1, 20 % dans Orvane devient 2,4 % dans le jeu, mais 99 % reste 91 % (une variante devenue majoritaire l’est aussi dans le jeu). Le phénotype de base absorbe le reste.",
          "properties": {
            "defaut": {
              "type": "number",
              "minimum": 0,
              "maximum": 1
            },
            "par_domaine": {
              "type": "object",
              "additionalProperties": {
                "type": "number",
                "minimum": 0,
                "maximum": 1
              }
            },
            "par_trait": {
              "type": "object",
              "additionalProperties": {
                "type": "number",
                "minimum": 0,
                "maximum": 1
              }
            },
            "par_biome": {
              "type": "object",
              "additionalProperties": {
                "type": "number",
                "minimum": 0,
                "maximum": 1
              }
            }
          }
        },
        "propagation_cycles": {
          "type": "integer",
          "minimum": 1,
          "description": "Un changement de fréquence dans Orvane est étalé sur autant de cycles côté jeu (interpolation linéaire entre instantanés)."
        },
        "inertie_max": {
          "type": "number",
          "minimum": 0,
          "maximum": 1,
          "description": "Variation maximale d'une fréquence exposée par cycle (0.05 = 5 points)."
        },
        "traits_rendus": {
          "type": "array",
          "items": {
            "type": "string"
          },
          "description": "Traits que le jeu sait représenter. Les autres sont masqués : leurs phénotypes sont fusionnés avec le phénotype de base à l'exposition (ils continuent d'évoluer dans Orvane)."
        },
        "seuil_extinction_jeu": {
          "type": "number",
          "minimum": 0,
          "description": "Effectif Orvane sous lequel le jeu cesse de faire apparaître le taxon (avant l'extinction réelle)."
        },
        "retour_apres_extinction": {
          "type": "boolean",
          "description": "Un taxon éteint peut-il revenir par recolonisation d'un biome voisin ?"
        },
        "mode": {
          "enum": [
            "compression",
            "relatif"
          ],
          "default": "compression",
          "description": "compression : la fréquence réelle d'un phénotype passe par la compression (sur la cote). relatif : le jeu garde ses propres taux (taux_jeu) à la génération 0, et ne suit que l'ÉCART d'Orvane depuis elle — une variante deux fois plus répandue qu'à la génération 0 l'est deux fois plus dans le jeu (sur la cote). Le jour un, le jeu est exactement ce qu'il était."
        },
        "taux_jeu": {
          "type": "object",
          "additionalProperties": {
            "type": "number",
            "minimum": 0,
            "maximum": 1
          },
          "description": "Mode relatif : par trait rendu, la chance qu'avait une naissance de le porter avant Orvane. Un phénotype à plusieurs traits rendus : le produit."
        },
        "reference_min": {
          "type": "number",
          "minimum": 0,
          "maximum": 1,
          "default": 0.01,
          "description": "Mode relatif : la fréquence de référence plancher, pour une combinaison absente de la génération 0 (elle n'apparaît dans le jeu qu'une fois installée)."
        },
        "seuil_extinction_part": {
          "type": "number",
          "minimum": 0,
          "maximum": 1,
          "default": 0.25,
          "description": "Une espèce disparaît du jeu sur une île quand son effectif sur les sols de l'île tombe sous seuil_extinction_jeu ET sous cette part de ce qu'il était à la génération 0 : une espèce rare dès le départ n'est pas rayée pour autant."
        },
        "non_rendus": {
          "enum": [
            "reel",
            "base"
          ],
          "default": "reel",
          "description": "Mode relatif : un phénotype dont aucun trait n'est rendu garde sa fréquence réelle (reel) — le jeu peut faire agir ses traits (docs/7-conduites.md) — ou se fond dans le plan de base (base)."
        },
        "quantitatifs": {
          "type": "object",
          "additionalProperties": false,
          "description": "Les traits continus (docs/8) que le jeu montre, et combien de leur variation naturelle.",
          "properties": {
            "rendus": {
              "type": "array",
              "items": {
                "type": "string"
              },
              "description": "Les traits continus que le jeu sait jouer (taille, vitesse, audace, sociabilite) : il en tire une valeur par bête et la rapporte."
            },
            "variation": {
              "type": "number",
              "minimum": 0,
              "maximum": 1,
              "description": "Part de la variation individuelle montrée. 0 : toutes les bêtes d’une population ont l’allure de sa moyenne (seul l’écart depuis la génération 0 se voit ; le jour un ne change rien). 1 : toute la variation naturelle."
            }
          }
        },
        "mefiance": {
          "type": "object",
          "additionalProperties": false,
          "description": "La méfiance et l'habituation (docs/12) : comment le jeu rend ce qu'une population a appris des joueurs. La distance de fuite est multipliée par fuite^méfiance × habitude^habituation.",
          "properties": {
            "rendue": {
              "type": "boolean",
              "description": "false : le jeu ne le montre pas (Orvane le tient quand même)."
            },
            "fuite": {
              "type": "number",
              "minimum": 1,
              "maximum": 5,
              "description": "Le facteur de la distance de fuite à méfiance 1 (2,2 par défaut)."
            },
            "habitude": {
              "type": "number",
              "minimum": 0.1,
              "maximum": 1,
              "description": "Le facteur à habituation 1 (0,5 par défaut)."
            }
          }
        },
        "bestiaire": {
          "enum": [
            "jeu",
            "orvane"
          ],
          "description": "Qui peuple les îles : « jeu » (par défaut) — la faune du jeu, suivie par Orvane, et les lignées qui en descendent ; « orvane » — la faune du jeu qu'Orvane ne simule pas dans ce monde (un monde né de la genèse) cède sa place aux lignées du monde, régime par régime, autant de bêtes qu'avant (traducteur de Stone Valley, §217)."
        }
      }
    },
    "influence": {
      "type": "object",
      "description": "Sens jeu → Orvane.",
      "required": [
        "poids",
        "plafonds"
      ],
      "additionalProperties": false,
      "properties": {
        "poids": {
          "type": "object",
          "description": "Poids d'une unité de chaque action, après dénormalisation, en individus équivalents retirés : 1 prélèvement = 1 ; négatif = favorable à la population (libération, nourrissage, habitat gagné).",
          "additionalProperties": {
            "type": "number"
          }
        },
        "denormaliser": {
          "type": "boolean",
          "description": "Rapporter les comptes à la fréquence exposée (une variante montrée à 2 % mais réelle à 20 % voit ses pertes multipliées par 10). Recommandé : true."
        },
        "exposition_ref": {
          "type": "number",
          "minimum": 0,
          "description": "Nombre de rencontres par compte et par cycle considéré comme activité normale ; au-delà, la pression d'un compte est ramenée à ce niveau."
        },
        "plafonds": {
          "type": "object",
          "required": [
            "par_compte_cycle",
            "part_max_compte"
          ],
          "additionalProperties": false,
          "properties": {
            "par_compte_cycle": {
              "type": "number",
              "description": "Pression maximale qu'un seul compte peut exercer sur un taxon par cycle (en individus équivalents)."
            },
            "part_max_compte": {
              "type": "number",
              "minimum": 0,
              "maximum": 1,
              "description": "Part maximale de la pression totale d'un taxon venant d'un seul compte."
            },
            "part_max_population": {
              "type": "number",
              "minimum": 0,
              "maximum": 1,
              "description": "Part maximale d'une population qu'un cycle de pressions peut retirer (empêche une extinction en un cycle)."
            },
            "part_max_jeu": {
              "type": "number",
              "minimum": 0,
              "maximum": 1,
              "description": "Part maximale de la pression totale d'un taxon venant d'un seul jeu, quand plusieurs jeux en montrent le taxon (comptée avant ce plafond, comme part_max_compte) : un jeu de mille joueurs ne fait pas seul l'histoire d'une espèce."
            }
          }
        },
        "memoire_cycles": {
          "type": "integer",
          "minimum": 1,
          "description": "Les pressions sont lissées sur autant de cycles (une chasse ponctuelle pèse peu, une chasse soutenue pèse)."
        },
        "pseudo_comptes": {
          "type": "number",
          "minimum": 0,
          "description": "Lissage de la dénormalisation : autant de prélèvements fictifs répartis selon les fréquences exposées sont ajoutés aux comptes observés, pour qu’une seule bête rare tuée ne vaille pas une persécution (20 par défaut)."
        }
      }
    }
  }
}
