{
  "orvane": "0.1",
  "jeu": "stone-valley",
  "monde": {
    "id": "sv-1",
    "graine": 7340021,
    "cycle": "24h",
    "biomes": "mondes/sv-1/biomes.json",
    "amorce": "mondes/sv-1/generation-0.json"
  },
  "exposition": {
    "compression": {
      "defaut": 0.1,
      "par_domaine": {
        "morphologie": 0.3,
        "defense": 0.2
      },
      "par_trait": {
        "gigantisme": 0.5
      },
      "par_biome": {
        "prairie-humide": 0.05
      }
    },
    "propagation_cycles": 3,
    "inertie_max": 0.05,
    "traits_rendus": [
      "glande-irritante",
      "jet-glandulaire",
      "gigantisme",
      "nanisme",
      "peau-epaisse"
    ],
    "seuil_extinction_jeu": 40,
    "retour_apres_extinction": true
  },
  "influence": {
    "poids": {
      "prelevement": 1,
      "capture": 1,
      "liberation": -1,
      "nourrissage": -0.2,
      "reproduction": -0.5,
      "deplacement": 1,
      "habitat_perdu": 1,
      "habitat_gagne": -1
    },
    "denormaliser": true,
    "exposition_ref": 40,
    "plafonds": {
      "par_compte_cycle": 25,
      "part_max_compte": 0.15,
      "part_max_population": 0.2
    },
    "memoire_cycles": 5
  }
}